{
    "land-base-path": "s3://land-bucket/my-folder/",
    "fail-base-path": "s3://fail-bucket/my-folder/",
    "pass-base-path": "s3://pass-bucket/my-folder/",
    "log-base-path": "s3://log-bucket/my-folder/",
    "iam-role-name": "role-name",
    "compress-data": true,
    "remove-tables-on-pass": true,
    "all-must-pass": true,
    "fail-unknown-files": {
        "exceptions": ["additional_file.txt", "another_additional_file.txt"]
    },
    "tables": {
        
            "table_blah": {
                "required": true,
                "pattern": null,
                "metadata": "metadata/table_blah.json",
                "linter": "goodtables",
                "expect-header": true
            }
        
    }
}
